,MCQ,Choice,Correct
0,"Which dynasty ruled Sindh and parts of Kutch, Punjab, and Balochistan from around 1351 to 1524 CE?",A:Samma dynasty | B:Ghaznavid dynasty | C:Mughal dynasty | D:Soomra dynasty,A
1,Who founded the Mughal Empire in 1526 after sweeping across the Khyber Pass?,A:Sher Shah Suri | B:Babur | C:Akbar | D:Jahangir,B
2,Which architectural legacy of the Mughals is located in Lahore and is known for its magnificent structures?,A:Shalimar Gardens | B:Wazir Khan Mosque | C:Badshahi Mosque | D:Lahore Fort,C
3,"Which Turkic ruler defeated the Mughal Empire in the year 1540, leading to Humayun's retreat to Kabul?",A:Sher Shah Suri | B:Babur | C:Akbar | D:Aurangzeb,A
4,"Which Muslim dynasty ruled the region of present-day Pakistan, Afghanistan, and northern India, known for their tolerance and multiculturalism?",A:Ghaznavid dynasty | B:Soomra dynasty | C:Samma dynasty | D:Mughal dynasty,D
